{
  "certificate_info": {
    "certificate_type": "戸籍謄本",
    "certificate_number": "桜花戸証第2025-00001号",
    "issue_date": "2025-01-13",
    "issuing_office": "桜花市役所市民課",
    "issuing_officer": "戸籍係：佐藤"
  },
  "register_info": {
    "本籍": "桜県桜花市中央地区一丁目一番一号",
    "筆頭者": {
      "氏名": "桜田一郎",
      "氏名よみがな": "さくらだいちろう"
    },
    "戸籍編製": {
      "編製日": "2008-10-15",
      "編製事由": "婚姻",
      "従前戸籍": "桜県桜花市西地区二丁目三番四号"
    }
  },
  "family_members": [
    {
      "身分事項": {
        "氏名": "桜田一郎",
        "氏名よみがな": "さくらだいちろう",
        "生年月日": "昭和五十三年三月十五日",
        "性別": "男",
        "続柄": "筆頭者",
        "配偶者区分": "夫"
      },
      "出生事項": {
        "出生日": "1978-03-15",
        "出生地": "桜県桜花市",
        "届出日": "1978-03-20",
        "届出人": "父"
      },
      "父母との続柄": {
        "父": "桜田太郎",
        "母": "桜田幸子",
        "続柄": "長男"
      },
      "婚姻事項": {
        "婚姻日": "2008-10-15",
        "配偶者氏名": "花田花子",
        "従前戸籍": "桜県桜花市西地区二丁目三番四号",
        "届出日": "2008-10-15"
      }
    },
    {
      "身分事項": {
        "氏名": "桜田花子",
        "氏名よみがな": "さくらだはなこ",
        "生年月日": "昭和五十五年七月二十二日",
        "性別": "女",
        "続柄": "妻",
        "配偶者区分": "妻"
      },
      "出生事項": {
        "出生日": "1980-07-22",
        "出生地": "東京都世田谷区",
        "届出日": "1980-07-25",
        "届出人": "父"
      },
      "父母との続柄": {
        "父": "花田次郎",
        "母": "花田良子",
        "続柄": "長女"
      },
      "婚姻事項": {
        "婚姻日": "2008-10-15",
        "配偶者氏名": "桜田一郎",
        "従前戸籍": "東京都世田谷区三軒茶屋一丁目",
        "届出日": "2008-10-15"
      }
    },
    {
      "身分事項": {
        "氏名": "桜田太郎",
        "氏名よみがな": "さくらだたろう",
        "生年月日": "平成二十二年九月五日",
        "性別": "男",
        "続柄": "長男",
        "配偶者区分": ""
      },
      "出生事項": {
        "出生日": "2010-09-05",
        "出生地": "桜県桜花市",
        "届出日": "2010-09-10",
        "届出人": "父"
      },
      "父母との続柄": {
        "父": "桜田一郎",
        "母": "桜田花子",
        "続柄": "長男"
      }
    },
    {
      "身分事項": {
        "氏名": "桜田美咲",
        "氏名よみがな": "さくらだみさき",
        "生年月日": "平成二十五年四月十二日",
        "性別": "女",
        "続柄": "長女",
        "配偶者区分": ""
      },
      "出生事項": {
        "出生日": "2013-04-12",
        "出生地": "桜県桜花市",
        "届出日": "2013-04-15",
        "届出人": "父"
      },
      "父母との続柄": {
        "父": "桜田一郎",
        "母": "桜田花子",
        "続柄": "長女"
      }
    }
  ],
  "戸籍事項": {
    "改製": [
      {
        "改製日": "2020-04-01",
        "改製事由": "法務省令による改製"
      }
    ]
  },
  "certification": {
    "認証文": "これは、戸籍に記録されている事項の全部を証明した書面である。",
    "発行者": {
      "役職": "桜県桜花市長",
      "氏名": "山本 太郎",
      "印章": "桜花市長之印"
    }
  },
  "usage_info": {
    "有効期限": "発行日から3ヶ月（パスポート申請は6ヶ月）",
    "使用目的": "パスポート申請",
    "提出先": "桜県旅券センター",
    "手数料": 450
  }
}